{
  "record_type": "RevocationRecord",
  "record_id": "pgw:l:8bf5a3ea8b11e54fe092fa66620d7062",
  "created_at": "2026-08-04T06:01:00.000Z",
  "responsible_role": "trusted-revocation-authority",
  "registry_snapshot_reference": {
    "registry_protocol_id": "project-gateway.registry",
    "registry_snapshot_format_version": "1.0",
    "registry_snapshot_id": "pgw:g:3fb51a11f2b23ba8c171326cbba7eb64",
    "registry_snapshot_digest": "sha-256:613112612ee7803db00c6e51826b3a63ee6ce6732b17c9b09ae8aff00db47c05",
    "protocol_compatibility": {
      "mode": "exact-release",
      "artifact_protocol_id": "project-gateway.artifact",
      "artifact_protocol_version": "1.0"
    }
  },
  "target": {
    "record_type": "ResultPublicationRecord",
    "record_id": "pgw:l:bbe7a46ace75d39197c83b683f767a0f"
  },
  "scope": "ordinary-review",
  "effective_at": "2026-08-04T06:10:00.000Z",
  "reason_code": "review-withdrawn"
}
